### ISSUE TITLE
client sents udp packets to both docker and docker_host ip

### ISSUE THREAD

**Issue by MaxNoe** [jitsi/docker-jitsi-meet#214]
I have set `DOCKER_HOST` to the public IP address of my server, however, on the client I see that it tries to sent UDP packets to both the DOCKER_HOST IP
and the private docker ip address of the container:

129.217.166.40 is the public ip address, 10.42.193.85 is the docker network address

```
# tcpdump udp -n
13:15:58.765234 IP 192.168.2.2.2190 > 192.168.2.255.2190: UDP, length 168
13:16:00.677015 IP 192.168.2.111.43804 > 10.42.193.85.10000: UDP, length 100
13:16:00.697257 IP 192.168.2.111.43804 > 129.217.166.40.10000: UDP, length 100
13:16:00.777236 IP 192.168.2.111.43804 > 10.42.193.85.10000: UDP, length 100
13:16:00.799018 IP 192.168.2.111.43804 > 129.217.166.40.10000: UDP, length 100
13:16:00.977258 IP 192.168.2.111.43804 > 10.42.193.85.10000: UDP, length 100
13:16:00.997490 IP 192.168.2.111.43804 > 129.217.166.40.10000: UDP, length 100
13:16:01.321624 IP 192.168.2.111.43804 > 10.42.193.85.10000: UDP, length 100
13:16:01.341849 IP 192.168.2.111.43804 > 129.217.166.40.10000: UDP, length 100
13:16:01.377428 IP 192.168.2.111.43804 > 10.42.193.85.10000: UDP, length 100
13:16:01.397750 IP 192.168.2.111.43804 > 129.217.166.40.10000: UDP, length 100
13:16:01.422284 IP 192.168.2.111.43804 > 10.42.193.85.10000: UDP, length 100
13:16:01.441871 IP 192.168.2.111.43804 > 129.217.166.40.10000: UDP, length 100
13:16:01.622344 IP 192.168.2.111.43804 > 10.42.193.85.10000: UDP, length 100
13:16:01.642029 IP 192.168.2.111.43804 > 129.217.166.40.10000: UDP, length 100
13:16:02.022408 IP 192.168.2.111.43804 > 10.42.193.85.10000: UDP, length 100
13:16:02.042194 IP 192.168.2.111.43804 > 129.217.166.40.10000: UDP, length 100
13:16:02.177457 IP 192.168.2.111.43804 > 10.42.193.85.10000: UDP, length 100
13:16:02.197875 IP 192.168.2.111.43804 > 129.217.166.40.10000: UDP, length 100
13:16:02.822887 IP 192.168.2.111.43804 > 10.42.193.85.10000: UDP, length 100
13:16:02.842546 IP 192.168.2.111.43804 > 129.217.166.40.10000: UDP, length 100
13:16:03.777646 IP 192.168.2.111.43804 > 10.42.193.85.10000: UDP, length 100
13:16:03.798261 IP 192.168.2.111.43804 > 129.217.166.40.10000: UDP, length 100
13:16:04.422690 IP 192.168.2.111.43804 > 10.42.193.85.10000: UDP, length 100
13:16:04.442588 IP 192.168.2.111.43804 > 129.217.166.40.10000: UDP, length 100
13:16:06.977735 IP 192.168.2.111.43804 > 10.42.193.85.10000: UDP, length 100
13:16:06.998234 IP 192.168.2.111.43804 > 129.217.166.40.10000: UDP, length 100
13:16:07.623006 IP 192.168.2.111.43804 > 10.42.193.85.10000: UDP, length 100
13:16:07.643213 IP 192.168.2.111.43804 > 129.217.166.40.10000: UDP, length 100
```

**Comment by saghul** [comment]
That's normal. The JVB advertises the IPs on the machine it's running (container in this case) to probe for connectivity (this is called ICE).

**Comment by MaxNoe** [comment]
Ok, thanks!
