### ISSUE TITLE
Jigasi RegistrationState=Connection Failed. reason=A timeout occurred while trying to connect to the server.

### ISSUE THREAD

**Issue by cclin81922** [jitsi/docker-jitsi-meet#1078]
I followed instructions described in this doc https://jitsi.github.io/handbook/docs/devops-guide/devops-guide-docker

Environment: Docker Desktop for Mac

Version: docker-jitsi-meet-stable-5963

Steps:
```
cp env.example .env

./gen-passwords.sh

mkdir -p ~/.jitsi-meet-cfg/{web/letsencrypt,transcripts,prosody/config,prosody/prosody-plugins-custom,jicofo,jvb,jigasi,jibri}

docker-compose up -d

# edit .env file
# to fill in my SIP credentials
# for testing purpose, I also use sip2sip.info the same SIP server described in the above doc

docker-compose -f docker-compose.yml -f jigasi.yml up
```

I am pretty sure that my SIP credentials are correct. I can both dial out and receive call with the same credentials using other SIP client.

Short Jigasi Logs:
```
Jigasi 2021-06-22 09:22:43.370 INFO: [33] org.jitsi.jigasi.SipGateway.registrationStateChanged().120 REG STATE CHANGE ProtocolProviderServiceSipImpl(SIP:jimlintw@sip2sip.info) -> RegistrationStateChangeEvent[ oldState=Registering; newState=RegistrationState=Connection Failed; userRequest=false; reasonCode=-1; reason=A timeout occurred while trying to connect to the server.]
```

Full Jigasi Logs:
```
[s6-init] making user provided files available at /var/run/s6/etc...exited 0.
[s6-init] ensuring user provided files have correct perms...exited 0.
[fix-attrs.d] applying ownership & permissions fixes...
[fix-attrs.d] done.
[cont-init.d] executing container initialization scripts...
[cont-init.d] 01-set-timezone: executing... 
[cont-init.d] 01-set-timezone: exited 0.
[cont-init.d] 10-config: executing... 
[cont-init.d] 10-config: exited 0.
[cont-init.d] done.
[services.d] starting services
[services.d] done.
Jigasi 2021-06-22 09:21:36.743 INFO: [11] org.jitsi.service.libjitsi.LibJitsi.log() Successfully started LibJitsi using as implementation: org.jitsi.impl.libjitsi.LibJitsiOSGiImpl
Jigasi 2021-06-22 09:21:36.782 INFO: [11] impl.configuration.ConfigurationActivator.log() Using properties file configuration store.
Jigasi 2021-06-22 09:21:36.791 INFO: [11] org.jitsi.impl.configuration.ConfigurationServiceImpl.log() java.vendor=AdoptOpenJDK
net.java.sip.communicator.impl.protocol.jabber.SKIP_RINGING_ON_SESSION_INITIATE=true
sun.java.launcher=SUN_STANDARD
sun.management.compiler=HotSpot 64-Bit Tiered Compilers
net.java.sip.communicator.impl.protocol.jabber.SKIP_DISCO_INFO_ON_SESSION_INITIATE=true
os.name=Linux
sun.boot.class.path=/usr/lib/jvm/adoptopenjdk-8-hotspot-jre-amd64/lib/resources.jar:/usr/lib/jvm/adoptopenjdk-8-hotspot-jre-amd64/lib/rt.jar:/usr/lib/jvm/adoptopenjdk-8-hotspot-jre-amd64/lib/sunrsasign.jar:/usr/lib/jvm/adoptopenjdk-8-hotspot-jre-amd64/lib/jsse.jar:/usr/lib/jvm/adoptopenjdk-8-hotspot-jre-amd64/lib/jce.jar:/usr/lib/jvm/adoptopenjdk-8-hotspot-jre-amd64/lib/charsets.jar:/usr/lib/jvm/adoptopenjdk-8-hotspot-jre-amd64/lib/jfr.jar:/usr/lib/jvm/adoptopenjdk-8-hotspot-jre-amd64/classes
net.java.sip.communicator.service.protocol.MIN_MEDIA_PORT_NUMBER=20000
java.util.logging.config.file=/config/logging.properties
java.vm.specification.vendor=Oracle Corporation
java.runtime.version=1.8.0_292-b10
user.name=jigasi
net.java.sip.communicator.impl.configuration.USE_PROPFILE_CONFIG=true
user.language=en
org.jitsi.impl.neomedia.transform.csrc.SsrcTransformEngine.dropMutedAudioSourceInReverseTransform=true
sun.boot.library.path=/usr/lib/jvm/adoptopenjdk-8-hotspot-jre-amd64/lib/amd64
net.java.sip.communicator.service.media.MIN_PORT_NUMBER=20000
java.version=1.8.0_292
user.timezone=UTC
sun.arch.data.model=64
java.endorsed.dirs=/usr/lib/jvm/adoptopenjdk-8-hotspot-jre-amd64/lib/endorsed
sun.cpu.isalist=
sun.jnu.encoding=ANSI_X3.4-1968
file.encoding.pkg=sun.io
file.separator=/
java.specification.name=Java Platform API Specification
java.class.version=52.0
user.country=US
net.java.sip.communicator.service.media.DISABLE_VIDEO_SUPPORT=true
java.home=/usr/lib/jvm/adoptopenjdk-8-hotspot-jre-amd64
java.vm.info=mixed mode
os.version=5.10.25-linuxkit
net.java.sip.communicator.impl.protocol.sip.SKIP_REINVITE_ON_FOCUS_CHANGE_PROP=true
path.separator=:
java.vm.version=25.292-b10
net.java.sip.communicator.CONFIGURATION_FILE_IS_READ_ONLY=true
javax.security.auth.useSubjectCredsOnly=false
java.awt.printerjob=sun.print.PSPrinterJob
sun.io.unicode.encoding=UnicodeLittle
awt.toolkit=sun.awt.X11.XToolkit
user.home=/usr/share/jigasi
java.specification.vendor=Oracle Corporation
net.java.sip.communicator.impl.protocol.jabber.DISABLE_COIN=true
net.java.sip.communicator.impl.neomedia.audioSystem=audiosilence
java.library.path=/usr/share/jigasi/lib
java.vendor.url=https://adoptopenjdk.net/
org.jitsi.service.audionotifier.AudioNotifierService=org.jitsi.impl.neomedia.notify.AudioNotifierServiceImpl
net.java.sip.communicator.service.protocol.MAX_MEDIA_PORT_NUMBER=20050
java.vm.vendor=AdoptOpenJDK
java.runtime.name=OpenJDK Runtime Environment
sun.java.command=org.jitsi.jigasi.Main --nocomponent=true --configdir=/ --configdirname=config --min-port=20000 --max-port=20050
java.class.path=/usr/share/jigasi/jigasi.jar:/usr/share/jigasi/lib/agafua-syslog-0.4.jar:/usr/share/jigasi/lib/animal-sniffer-annotations-1.17.jar:/usr/share/jigasi/lib/annotations-15.0.jar:/usr/share/jigasi/lib/annotations-4.1.1.4.jar:/usr/share/jigasi/lib/aopalliance-repackaged-2.5.0.jar:/usr/share/jigasi/lib/api-common-1.8.1.jar:/usr/share/jigasi/lib/auto-value-annotations-1.6.6.jar:/usr/share/jigasi/lib/bcpkix-jdk15on-1.54.jar:/usr/share/jigasi/lib/bcprov-jdk15on-1.54.jar:/usr/share/jigasi/lib/callstats-java-sdk-5.2.0.jar:/usr/share/jigasi/lib/cglib-nodep-2.2.jar:/usr/share/jigasi/lib/checker-qual-2.5.2.jar:/usr/share/jigasi/lib/commons-codec-1.9.jar:/usr/share/jigasi/lib/commons-collections4-4.2.jar:/usr/share/jigasi/lib/commons-compress-1.20.jar:/usr/share/jigasi/lib/commons-lang3-3.9.jar:/usr/share/jigasi/lib/commons-logging-1.2.jar:/usr/share/jigasi/lib/concurrentlinkedhashmap-lru-1.0_jdk5.jar:/usr/share/jigasi/lib/conscrypt-openjdk-uber-2.2.1.jar:/usr/share/jigasi/lib/core-2.0.1.jar:/usr/share/jigasi/lib/dbus-java-2.7.jar:/usr/share/jigasi/lib/debug-1.1.1.jar:/usr/share/jigasi/lib/dnsjava-2.1.7.jar:/usr/share/jigasi/lib/dnssecjava-1.1.jar:/usr/share/jigasi/lib/dom4j-1.6.1.jar:/usr/share/jigasi/lib/error_prone_annotations-2.2.0.jar:/usr/share/jigasi/lib/failureaccess-1.0.jar:/usr/share/jigasi/lib/fmj-1.0-SNAPSHOT.jar:/usr/share/jigasi/lib/gax-1.50.1.jar:/usr/share/jigasi/lib/gax-grpc-1.50.1.jar:/usr/share/jigasi/lib/gax-httpjson-0.66.1.jar:/usr/share/jigasi/lib/google-api-client-1.30.4.jar:/usr/share/jigasi/lib/google-api-services-translate-v2-rev20170525-1.30.1.jar:/usr/share/jigasi/lib/google-auth-library-credentials-0.18.0.jar:/usr/share/jigasi/lib/google-auth-library-oauth2-http-0.18.0.jar:/usr/share/jigasi/lib/google-cloud-core-1.91.3.jar:/usr/share/jigasi/lib/google-cloud-core-http-1.91.3.jar:/usr/share/jigasi/lib/google-cloud-speech-1.22.1.jar:/usr/share/jigasi/lib/google-cloud-translate-1.94.1.jar:/usr/share/jigasi/lib/google-http-client-1.32.1.jar:/usr/share/jigasi/lib/google-http-client-appengine-1.32.1.jar:/usr/share/jigasi/lib/google-http-client-jackson2-1.32.1.jar:/usr/share/jigasi/lib/google-oauth-client-1.30.3.jar:/usr/share/jigasi/lib/grpc-alts-1.25.0.jar:/usr/share/jigasi/lib/grpc-api-1.25.0.jar:/usr/share/jigasi/lib/grpc-auth-1.25.0.jar:/usr/share/jigasi/lib/grpc-context-1.25.0.jar:/usr/share/jigasi/lib/grpc-core-1.25.0.jar:/usr/share/jigasi/lib/grpc-grpclb-1.25.0.jar:/usr/share/jigasi/lib/grpc-netty-shaded-1.25.0.jar:/usr/share/jigasi/lib/grpc-protobuf-1.25.0.jar:/usr/share/jigasi/lib/grpc-protobuf-lite-1.25.0.jar:/usr/share/jigasi/lib/grpc-stub-1.25.0.jar:/usr/share/jigasi/lib/gson-2.3.1.jar:/usr/share/jigasi/lib/guava-27.0-jre.jar:/usr/share/jigasi/lib/hexdump-0.2.1.jar:/usr/share/jigasi/lib/hk2-api-2.5.0.jar:/usr/share/jigasi/lib/hk2-locator-2.5.0.jar:/usr/share/jigasi/lib/hk2-utils-2.5.0.jar:/usr/share/jigasi/lib/httpclient-4.4.jar:/usr/share/jigasi/lib/httpcore-4.4.jar:/usr/share/jigasi/lib/httpmime-4.4.jar:/usr/share/jigasi/lib/ice4j-2.0.0-SNAPSHOT.jar:/usr/share/jigasi/lib/j2objc-annotations-1.1.jar:/usr/share/jigasi/lib/jackson-annotations-2.9.9.jar:/usr/share/jigasi/lib/jackson-core-2.10.0.jar:/usr/share/jigasi/lib/jackson-databind-2.9.9.jar:/usr/share/jigasi/lib/jackson-module-jaxb-annotations-2.9.9.jar:/usr/share/jigasi/lib/jain-sip-ri-ossonly-1.2.98c7f8c-jitsi-oss1.jar:/usr/share/jigasi/lib/jakarta.annotation-api-1.3.4.jar:/usr/share/jigasi/lib/jakarta.inject-2.5.0.jar:/usr/share/jigasi/lib/jakarta.ws.rs-api-2.1.5.jar:/usr/share/jigasi/lib/java-dogstatsd-client-2.5.jar:/usr/share/jigasi/lib/java-sdp-nist-bridge-1.2.jar:/usr/share/jigasi/lib/javassist-3.22.0-CR2.jar:/usr/share/jigasi/lib/javax.annotation-api-1.3.2.jar:/usr/share/jigasi/lib/javax.servlet-api-3.1.0.jar:/usr/share/jigasi/lib/jbosh-0.9.2.jar:/usr/share/jigasi/lib/jcip-annotations-1.0.jar:/usr/share/jigasi/lib/jcl-core-2.8.jar:/usr/share/jigasi/lib/jersey-client-2.29.jar:/usr/share/jigasi/lib/jersey-common-2.29.jar:/usr/share/jigasi/lib/jersey-container-jetty-http-2.29.jar:/usr/share/jigasi/lib/jersey-container-servlet-2.29.jar:/usr/share/jigasi/lib/jersey-container-servlet-core-2.29.jar:/usr/share/jigasi/lib/jersey-entity-filtering-2.29.jar:/usr/share/jigasi/lib/jersey-hk2-2.29.jar:/usr/share/jigasi/lib/jersey-media-jaxb-2.29.jar:/usr/share/jigasi/lib/jersey-media-json-jackson-2.29.jar:/usr/share/jigasi/lib/jersey-server-2.29.jar:/usr/share/jigasi/lib/jetty-client-9.4.15.v20190215.jar:/usr/share/jigasi/lib/jetty-continuation-9.4.12.v20180830.jar:/usr/share/jigasi/lib/jetty-http-9.4.15.v20190215.jar:/usr/share/jigasi/lib/jetty-io-9.4.15.v20190215.jar:/usr/share/jigasi/lib/jetty-proxy-9.4.15.v20190215.jar:/usr/share/jigasi/lib/jetty-security-9.4.15.v20190215.jar:/usr/share/jigasi/lib/jetty-server-9.4.15.v20190215.jar:/usr/share/jigasi/lib/jetty-servlet-9.4.15.v20190215.jar:/usr/share/jigasi/lib/jetty-util-9.4.15.v20190215.jar:/usr/share/jigasi/lib/jetty-webapp-7.0.1.v20091125.jar:/usr/share/jigasi/lib/jetty-xml-9.4.15.v20190215.jar:/usr/share/jigasi/lib/jicoco-1.1-22-gbec9167.jar:/usr/share/jigasi/lib/jitsi-android-osgi-1.0-SNAPSHOT.jar:/usr/share/jigasi/lib/jitsi-argdelegation-2.13.c81e58f1a.jar:/usr/share/jigasi/lib/jitsi-certificate-2.13.c81e58f1a.jar:/usr/share/jigasi/lib/jitsi-configuration-2.13.c81e58f1a.jar:/usr/share/jigasi/lib/jitsi-contactlist-2.13.c81e58f1a.jar:/usr/share/jigasi/lib/jitsi-credentialsstorage-2.13.c81e58f1a.jar:/usr/share/jigasi/lib/jitsi-desktoputil-2.13.c81e58f1a.jar:/usr/share/jigasi/lib/jitsi-dns-2.13.c81e58f1a.jar:/usr/share/jigasi/lib/jitsi-dnsservice-2.13.c81e58f1a.jar:/usr/share/jigasi/lib/jitsi-fileaccess-2.13.c81e58f1a.jar:/usr/share/jigasi/lib/jitsi-hid-2.13.c81e58f1a.jar:/usr/share/jigasi/lib/jitsi-lgpl-dependencies-1.1-SNAPSHOT.jar:/usr/share/jigasi/lib/jitsi-muc-2.13.c81e58f1a.jar:/usr/share/jigasi/lib/jitsi-neomedia-2.13.c81e58f1a.jar:/usr/share/jigasi/lib/jitsi-netaddr-2.13.c81e58f1a.jar:/usr/share/jigasi/lib/jitsi-notification-service-2.13.c81e58f1a.jar:/usr/share/jigasi/lib/jitsi-packetlogging-2.13.c81e58f1a.jar:/usr/share/jigasi/lib/jitsi-protocol-2.13.c81e58f1a.jar:/usr/share/jigasi/lib/jitsi-protocol-jabber-2.13.c81e58f1a.jar:/usr/share/jigasi/lib/jitsi-protocol-media-2.13.c81e58f1a.jar:/usr/share/jigasi/lib/jitsi-protocol-sip-2.13.c81e58f1a.jar:/usr/share/jigasi/lib/jitsi-reconnect-2.13.c81e58f1a.jar:/usr/share/jigasi/lib/jitsi-resourcemanager-2.13.c81e58f1a.jar:/usr/share/jigasi/lib/jitsi-srtp-1.0-24-g6823dfa.jar:/usr/share/jigasi/lib/jitsi-stats-1.0-5-g2a92c0e.jar:/usr/share/jigasi/lib/jitsi-sysactivity-2.13.c81e58f1a.jar:/usr/share/jigasi/lib/jitsi-systray-service-2.13.c81e58f1a.jar:/usr/share/jigasi/lib/jitsi-ui-service-2.13.c81e58f1a.jar:/usr/share/jigasi/lib/jitsi-util-2.13.c81e58f1a.jar:/usr/share/jigasi/lib/jitsi-utils-1.0-39-gd481c98.jar:/usr/share/jigasi/lib/jitsi-version-2.13.c81e58f1a.jar:/usr/share/jigasi/lib/jitsi-webrtcvadwrapper-1.0-SNAPSHOT.jar:/usr/share/jigasi/lib/jitsi-xmpp-extensions-1.0-17-gcf66bcd.jar:/usr/share/jigasi/lib/jna-4.1.0.jar:/usr/share/jigasi/lib/jnsapi-0.0.3-jitsi-smack4.2-3.jar:/usr/share/jigasi/lib/jose4j-0.5.1.jar:/usr/share/jigasi/lib/json-20180130.jar:/usr/share/jigasi/lib/json-simple-1.1.1.jar:/usr/share/jigasi/lib/jsr305-3.0.2.jar:/usr/share/jigasi/lib/jxmpp-core-0.6.2.jar:/usr/share/jigasi/lib/jxmpp-jid-0.6.2.jar:/usr/share/jigasi/lib/jxmpp-util-cache-0.6.2.jar:/usr/share/jigasi/lib/laf-widget-4.0.jar:/usr/share/jigasi/lib/libidn-1.15.jar:/usr/share/jigasi/lib/libjitsi-1.0-55-gcdf3e894.jar:/usr/share/jigasi/lib/listenablefuture-9999.0-empty-to-avoid-conflict-with-guava.jar:/usr/share/jigasi/lib/log4j-api-2.3.jar:/usr/share/jigasi/lib/log4j-core-2.3.jar:/usr/share/jigasi/lib/object-cloner-0.1.jar:/usr/share/jigasi/lib/objenesis-2.1.jar:/usr/share/jigasi/lib/okhttp-3.9.1.jar:/usr/share/jigasi/lib/okio-1.13.0.jar:/usr/share/jigasi/lib/opencensus-api-0.24.0.jar:/usr/share/jigasi/lib/opencensus-contrib-grpc-metrics-0.21.0.jar:/usr/share/jigasi/lib/opencensus-contrib-http-util-0.24.0.jar:/usr/share/jigasi/lib/orange-extensions-1.3.0.jar:/usr/share/jigasi/lib/org.apache.felix.framework-4.4.0.jar:/usr/share/jigasi/lib/org.apache.felix.main-4.4.0.jar:/usr/share/jigasi/lib/org.osgi.core-4.3.1.jar:/usr/share/jigasi/lib/osgi-resource-locator-1.0.3.jar:/usr/share/jigasi/lib/perfmark-api-0.19.0.jar:/usr/share/jigasi/lib/proto-google-cloud-speech-v1-1.22.1.jar:/usr/share/jigasi/lib/proto-google-cloud-speech-v1p1beta1-0.75.1.jar:/usr/share/jigasi/lib/proto-google-cloud-translate-v3-1.0.1.jar:/usr/share/jigasi/lib/proto-google-cloud-translate-v3beta1-0.77.1.jar:/usr/share/jigasi/lib/proto-google-common-protos-1.17.0.jar:/usr/share/jigasi/lib/proto-google-iam-v1-0.13.0.jar:/usr/share/jigasi/lib/protobuf-java-3.10.0.jar:/usr/share/jigasi/lib/protobuf-java-util-3.10.0.jar:/usr/share/jigasi/lib/reflections-0.9.11.jar:/usr/share/jigasi/lib/sdes4j-1.1.5.jar:/usr/share/jigasi/lib/sdp-api-1.0.jar:/usr/share/jigasi/lib/sentry-1.7.30.jar:/usr/share/jigasi/lib/sip-api-1.2-1.2.jar:/usr/share/jigasi/lib/slf4j-api-1.7.30.jar:/usr/share/jigasi/lib/slf4j-jdk14-1.7.30.jar:/usr/share/jigasi/lib/slf4j-simple-1.6.1.jar:/usr/share/jigasi/lib/smack-bosh-4.2.4-4fa73bd.jar:/usr/share/jigasi/lib/smack-core-4.2.4-4fa73bd.jar:/usr/share/jigasi/lib/smack-debug-4.2.4-47d17fc.jar:/usr/share/jigasi/lib/smack-experimental-4.2.4-47d17fc.jar:/usr/share/jigasi/lib/smack-extensions-4.2.4-4fa73bd.jar:/usr/share/jigasi/lib/smack-im-4.2.4-4fa73bd.jar:/usr/share/jigasi/lib/smack-java7-4.2.4-47d17fc.jar:/usr/share/jigasi/lib/smack-legacy-4.2.4-47d17fc.jar:/usr/share/jigasi/lib/smack-resolver-javax-4.2.4-47d17fc.jar:/usr/share/jigasi/lib/smack-sasl-javax-4.2.4-47d17fc.jar:/usr/share/jigasi/lib/smack-tcp-4.2.4-4fa73bd.jar:/usr/share/jigasi/lib/spotbugs-annotations-4.0.0-RC1.jar:/usr/share/jigasi/lib/threetenbp-1.4.0.jar:/usr/share/jigasi/lib/tinder-1.3.0.jar:/usr/share/jigasi/lib/unix-0.5.1.jar:/usr/share/jigasi/lib/validation-api-2.0.1.Final.jar:/usr/share/jigasi/lib/vorbis-java-core-0.8.jar:/usr/share/jigasi/lib/websocket-api-9.4.15.v20190215.jar:/usr/share/jigasi/lib/websocket-client-9.4.15.v20190215.jar:/usr/share/jigasi/lib/websocket-common-9.4.15.v20190215.jar:/usr/share/jigasi/lib/weupnp-0.1.4.jar:/usr/share/jigasi/lib/xml-apis-1.0.b2.jar:/usr/share/jigasi/lib/xmlpull-1.1.3.4a.jar:/usr/share/jigasi/lib/xpp3-1.1.4c.jar:/usr/share/jigasi/lib/zrtp4j-light-4.1.1.jar
java.vm.specification.name=Java Virtual Machine Specification
net.java.sip.communicator.SC_HOME_DIR_LOCATION=/
net.java.sip.communicator.service.media.DISABLE_AUDIO_SUPPORT=false
java.vm.specification.version=1.8
sun.cpu.endian=little
sun.os.patch.level=unknown
java.io.tmpdir=/tmp
net.java.sip.communicator.service.media.MAX_PORT_NUMBER=20050
java.vendor.url.bug=https://github.com/AdoptOpenJDK/openjdk-support/issues
os.arch=amd64
java.awt.graphicsenv=sun.awt.X11GraphicsEnvironment
java.ext.dirs=/usr/lib/jvm/adoptopenjdk-8-hotspot-jre-amd64/lib/ext:/usr/java/packages/lib/ext
user.dir=/run/s6/services/jigasi
line.separator=

java.vm.name=OpenJDK 64-Bit Server VM
java.security.auth.login.config=gss.conf
org.jitsi.impl.neomedia.device.PulseAudioSystem.disabled=true
org.jitsi.impl.neomedia.device.PortAudioSystem.disabled=true
net.java.sip.communicator.impl.neomedia.video.maxbandwidth=2147483647
file.encoding=ANSI_X3.4-1968
java.specification.version=1.8
net.java.sip.communicator.SC_HOME_DIR_NAME=config

Jigasi 2021-06-22 09:21:36.795 INFO: [11] org.jitsi.impl.configuration.ConfigurationServiceImpl.log() Normal classloader
Jigasi 2021-06-22 09:21:36.796 INFO: [11] org.jitsi.impl.configuration.ConfigurationServiceImpl.log() failed to find jitsi-defaults.properties with class loader, will continue without it.
Jigasi 2021-06-22 09:21:36.797 INFO: [11] org.jitsi.impl.configuration.ConfigurationServiceImpl.log() Normal classloader
Jigasi 2021-06-22 09:21:36.798 INFO: [11] org.jitsi.impl.configuration.ConfigurationServiceImpl.log() failed to find jitsi-default-overrides.properties with class loader, will continue without it.
Jigasi 2021-06-22 09:21:36.837 INFO: [11] impl.resources.ResourceManagementActivator.start().81 Resource manager STARTED
Jigasi 2021-06-22 09:21:36.839 INFO: [11] impl.resources.ResourceManagementActivator.start().90 Resource manager REGISTERED
Jigasi 2021-06-22 09:21:36.842 INFO: [11] impl.dns.DnsUtilActivator.start().120 DNS service ... [STARTING]
Jigasi 2021-06-22 09:21:36.880 INFO: [11] util.NetworkUtils.<clinit>().117 java.net.preferIPv6Addresses=null
Jigasi 2021-06-22 09:21:36.880 INFO: [11] util.NetworkUtils.<clinit>().118 java.net.preferIPv4Stack=null
Jigasi 2021-06-22 09:21:36.886 INFO: [11] impl.dns.DnsUtilActivator.start().146 ParallelResolver ... [REGISTERED]
Jigasi 2021-06-22 09:21:36.886 INFO: [11] impl.dns.DnsUtilActivator.start().160 DNS service ... [STARTED]
Jigasi 2021-06-22 09:21:37.128 INFO: [11] impl.netaddr.NetworkAddressManagerServiceImpl.start().92 Network Address Manager         ...[  STARTED ]
Jigasi 2021-06-22 09:21:37.128 INFO: [11] impl.netaddr.NetworkAddressManagerServiceImpl.start().98 Network Address Manager Service ...[REGISTERED]
Jigasi 2021-06-22 09:21:37.134 INFO: [12] impl.netaddr.NetworkConfigurationWatcher.checkNetworkInterfaces().398 Currently Active eth0:[/172.30.0.6]
Jigasi 2021-06-22 09:21:37.135 INFO: [12] impl.dns.DnsUtilActivator.logDNSServers().295 Loading or Reloading resolver config, default DNS servers are: 127.0.0.11, 
Jigasi 2021-06-22 09:21:37.188 WARNING: [11] impl.sysactivity.SystemActivityNotifications.<clinit>().141 Failed to initialize native counterpart
java.lang.UnsatisfiedLinkError: Directory separator should not appear in library name: /tmp/jna--1160142225/jna3199449728165634125.tmp
	at java.lang.Runtime.loadLibrary0(Runtime.java:868)
	at java.lang.System.loadLibrary(System.java:1124)
	at org.jitsi.utils.JNIUtils.loadNativeInClassloader(JNIUtils.java:137)
	at org.jitsi.utils.JNIUtils.loadLibrary(JNIUtils.java:86)
	at org.jitsi.utils.JNIUtils.loadLibrary(JNIUtils.java:45)
	at net.java.sip.communicator.impl.sysactivity.SystemActivityNotifications.<clinit>(SystemActivityNotifications.java:125)
	at net.java.sip.communicator.impl.sysactivity.SystemActivityNotificationsServiceImpl.isSupported(SystemActivityNotificationsServiceImpl.java:606)
	at net.java.sip.communicator.impl.sysactivity.SystemActivityNotificationsServiceImpl.start(SystemActivityNotificationsServiceImpl.java:143)
	at net.java.sip.communicator.impl.sysactivity.SysActivityActivator.start(SysActivityActivator.java:70)
	at org.jitsi.impl.osgi.framework.BundleImpl.start(BundleImpl.java:307)
	at org.jitsi.impl.osgi.framework.launch.FrameworkImpl.startLevelChanged(FrameworkImpl.java:472)
	at org.jitsi.impl.osgi.framework.startlevel.FrameworkStartLevelImpl$Command.run(FrameworkStartLevelImpl.java:137)
	at org.jitsi.impl.osgi.framework.AsyncExecutor.runInThread(AsyncExecutor.java:122)
	at org.jitsi.impl.osgi.framework.AsyncExecutor.access$000(AsyncExecutor.java:28)
	at org.jitsi.impl.osgi.framework.AsyncExecutor$1.run(AsyncExecutor.java:231)
Jigasi 2021-06-22 09:21:37.249 SEVERE: [11] impl.sysactivity.NetworkManagerListenerImpl.<init>().60 Cannot obtain dbus connection
org.freedesktop.dbus.exceptions.DBusException: Failed to connect to bus No such file or directory
	at org.freedesktop.dbus.DBusConnection.<init>(Unknown Source)
	at org.freedesktop.dbus.DBusConnection.getConnection(Unknown Source)
	at net.java.sip.communicator.impl.sysactivity.NetworkManagerListenerImpl.<init>(NetworkManagerListenerImpl.java:56)
	at sun.reflect.NativeConstructorAccessorImpl.newInstance0(Native Method)
	at sun.reflect.NativeConstructorAccessorImpl.newInstance(NativeConstructorAccessorImpl.java:62)
	at sun.reflect.DelegatingConstructorAccessorImpl.newInstance(DelegatingConstructorAccessorImpl.java:45)
	at java.lang.reflect.Constructor.newInstance(Constructor.java:423)
	at java.lang.Class.newInstance(Class.java:442)
	at net.java.sip.communicator.impl.sysactivity.SystemActivityNotificationsServiceImpl.getCurrentRunningManager(SystemActivityNotificationsServiceImpl.java:643)
	at net.java.sip.communicator.impl.sysactivity.SystemActivityNotificationsServiceImpl.start(SystemActivityNotificationsServiceImpl.java:154)
	at net.java.sip.communicator.impl.sysactivity.SysActivityActivator.start(SysActivityActivator.java:70)
	at org.jitsi.impl.osgi.framework.BundleImpl.start(BundleImpl.java:307)
	at org.jitsi.impl.osgi.framework.launch.FrameworkImpl.startLevelChanged(FrameworkImpl.java:472)
	at org.jitsi.impl.osgi.framework.startlevel.FrameworkStartLevelImpl$Command.run(FrameworkStartLevelImpl.java:137)
	at org.jitsi.impl.osgi.framework.AsyncExecutor.runInThread(AsyncExecutor.java:122)
	at org.jitsi.impl.osgi.framework.AsyncExecutor.access$000(AsyncExecutor.java:28)
	at org.jitsi.impl.osgi.framework.AsyncExecutor$1.run(AsyncExecutor.java:231)
Jigasi 2021-06-22 09:21:37.267 INFO: [11] impl.packetlogging.PacketLoggingActivator.start().100 Packet Logging Service ...[REGISTERED]
Jigasi 2021-06-22 09:21:37.270 INFO: [11] service.notification.NotificationServiceActivator.start().48 Notification Service...[  STARTED ]
Jigasi 2021-06-22 09:21:37.277 INFO: [11] service.notification.NotificationServiceActivator.start().55 Notification Service ...[REGISTERED]
Jigasi 2021-06-22 09:21:37.779 SEVERE: [11] org.jitsi.impl.neomedia.device.DeviceConfiguration.log() Failed to register custom Renderer org.jitsi.impl.neomedia.jmfext.media.renderer.audio.PulseAudioRenderer with JMF.
java.lang.IllegalStateException: audioSystem
	at org.jitsi.impl.neomedia.jmfext.media.renderer.audio.PulseAudioRenderer.<init>(PulseAudioRenderer.java:156)
	at org.jitsi.impl.neomedia.jmfext.media.renderer.audio.PulseAudioRenderer.<init>(PulseAudioRenderer.java:136)
	at sun.reflect.NativeConstructorAccessorImpl.newInstance0(Native Method)
	at sun.reflect.NativeConstructorAccessorImpl.newInstance(NativeConstructorAccessorImpl.java:62)
	at sun.reflect.DelegatingConstructorAccessorImpl.newInstance(DelegatingConstructorAccessorImpl.java:45)
	at java.lang.reflect.Constructor.newInstance(Constructor.java:423)
	at java.lang.Class.newInstance(Class.java:442)
	at org.jitsi.impl.neomedia.device.DeviceConfiguration.registerCustomRenderers(DeviceConfiguration.java:1047)
	at org.jitsi.impl.neomedia.device.DeviceConfiguration.<init>(DeviceConfiguration.java:366)
	at org.jitsi.impl.neomedia.MediaServiceImpl.<init>(MediaServiceImpl.java:163)
	at sun.reflect.NativeConstructorAccessorImpl.newInstance0(Native Method)
	at sun.reflect.NativeConstructorAccessorImpl.newInstance(NativeConstructorAccessorImpl.java:62)
	at sun.reflect.DelegatingConstructorAccessorImpl.newInstance(DelegatingConstructorAccessorImpl.java:45)
	at java.lang.reflect.Constructor.newInstance(Constructor.java:423)
	at java.lang.Class.newInstance(Class.java:442)
	at org.jitsi.impl.libjitsi.LibJitsiImpl$ServiceLock.initializeService(LibJitsiImpl.java:196)
	at org.jitsi.impl.libjitsi.LibJitsiImpl$ServiceLock.getService(LibJitsiImpl.java:131)
	at org.jitsi.impl.libjitsi.LibJitsiImpl.getService(LibJitsiImpl.java:91)
	at org.jitsi.impl.libjitsi.LibJitsiOSGiImpl.getService(LibJitsiOSGiImpl.java:69)
	at org.jitsi.service.libjitsi.LibJitsi.invokeGetServiceOnImpl(LibJitsi.java:173)
	at org.jitsi.service.libjitsi.LibJitsi.getMediaService(LibJitsi.java:125)
	at net.java.sip.communicator.impl.neomedia.NeomediaActivator.start(NeomediaActivator.java:391)
	at org.jitsi.impl.osgi.framework.BundleImpl.start(BundleImpl.java:307)
	at org.jitsi.impl.osgi.framework.launch.FrameworkImpl.startLevelChanged(FrameworkImpl.java:472)
	at org.jitsi.impl.osgi.framework.startlevel.FrameworkStartLevelImpl$Command.run(FrameworkStartLevelImpl.java:137)
	at org.jitsi.impl.osgi.framework.AsyncExecutor.runInThread(AsyncExecutor.java:122)
	at org.jitsi.impl.osgi.framework.AsyncExecutor.access$000(AsyncExecutor.java:28)
	at org.jitsi.impl.osgi.framework.AsyncExecutor$1.run(AsyncExecutor.java:231)
Jigasi 2021-06-22 09:21:37.823 INFO: [11] impl.neomedia.NeomediaActivator.start().542 Audio Notifier Service ...[REGISTERED]
Jigasi 2021-06-22 09:21:37.851 INFO: [11] org.jitsi.version.AbstractVersionActivator.log() VersionService registered: Jigasi 1.1.195-g65ef768
Jigasi 2021-06-22 09:21:37.887 FINE: [11] plugin.reconnectplugin.ReconnectPluginActivator.start().193 Found 0 already installed providers.
Jigasi 2021-06-22 09:21:37.962 INFO: [11] org.jitsi.jigasi.JigasiBundleActivator.start().207 initialized SipGateway
Jigasi 2021-06-22 09:21:37.966 INFO: [11] org.jitsi.jigasi.JigasiBundleActivator.start().245 skipped initialization of TranscriptionGateway
SLF4J: Class path contains multiple SLF4J bindings.
SLF4J: Found binding in [jar:file:/usr/share/jigasi/lib/slf4j-jdk14-1.7.30.jar!/org/slf4j/impl/StaticLoggerBinder.class]
SLF4J: Found binding in [jar:file:/usr/share/jigasi/lib/slf4j-simple-1.6.1.jar!/org/slf4j/impl/StaticLoggerBinder.class]
SLF4J: See http://www.slf4j.org/codes.html#multiple_bindings for an explanation.
SLF4J: Actual binding is of type [org.slf4j.impl.JDK14LoggerFactory]
Jigasi 2021-06-22 09:21:38.030 INFO: [11] org.eclipse.jetty.util.log.initialized() Logging initialized @2205ms to org.eclipse.jetty.util.log.Slf4jLog
Jigasi 2021-06-22 09:21:38.144 INFO: [11] org.eclipse.jetty.server.Server.doStart() jetty-9.4.15.v20190215; built: 2019-02-15T16:53:49.381Z; git: eb70b240169fcf1abbd86af36482d1c49826fa0b; jvm 1.8.0_292-b10
Jigasi 2021-06-22 09:21:38.242 INFO: [21] impl.protocol.sip.SipLogger.logInfo().196 Info from the JAIN-SIP stack: value -1000 will be used for reliableConnectionKeepAliveTimeout stack property
Jigasi 2021-06-22 09:21:38.243 INFO: [21] impl.protocol.sip.SipLogger.logInfo().196 Info from the JAIN-SIP stack: Setting Stack Thread priority to 10
Jigasi 2021-06-22 09:21:38.251 INFO: [11] org.eclipse.jetty.server.AbstractConnector.doStart() Started MuxServerConnector@ae05593{HTTP/1.1,[http/1.1]}{0.0.0.0:8788}
Jigasi 2021-06-22 09:21:38.252 INFO: [11] org.eclipse.jetty.server.Server.doStart() Started @2432ms
Jigasi 2021-06-22 09:21:38.252 WARNING: [21] impl.protocol.sip.SipLogger.logWarning().185 Warning from the JAIN-SIP stackusing default tls security policy
Jigasi 2021-06-22 09:21:38.252 INFO: [11] org.jitsi.rest.AbstractJettyBundleActivator.log() Not starting the Jetty service for org.jitsi.jigasi.rest.TranscriptServerBundleActivator(port=-1)
Jigasi 2021-06-22 09:21:38.256 WARNING: [21] impl.protocol.sip.SipLogger.logWarning().185 Warning from the JAIN-SIP stackUsing default keystore type jks
Jigasi 2021-06-22 09:21:38.256 WARNING: [21] impl.protocol.sip.SipLogger.logWarning().185 Warning from the JAIN-SIP stackTLS server settings will be inactive - TLS key store will use JVM defaults keyStoreType=jks javax.net.ssl.keyStore=null javax.net.ssl.keyStorePassword=null
Jigasi 2021-06-22 09:21:38.256 INFO: [21] impl.protocol.sip.SipLogger.logInfo().196 Info from the JAIN-SIP stack: javax.net.ssl.trustStorePassword is null, using the password passed through javax.net.ssl.keyStorePassword
Jigasi 2021-06-22 09:21:38.256 WARNING: [21] impl.protocol.sip.SipLogger.logWarning().185 Warning from the JAIN-SIP stackUsing default truststore type jks
Jigasi 2021-06-22 09:21:38.257 WARNING: [21] impl.protocol.sip.SipLogger.logWarning().185 Warning from the JAIN-SIP stackTLS trust settings will be inactive - TLS trust store will use JVM defaults. trustStoreType=jks javax.net.ssl.trustStore=null javax.net.ssl.trustStorePassword=null
Jigasi 2021-06-22 09:21:38.272 WARNING: [11] org.jitsi.jigasi.xmpp.CallControl.<init>().123 Always trust in remote TLS certificates mode is enabled
Jigasi 2021-06-22 09:21:38.274 INFO: [1] org.jitsi.impl.configuration.ConfigurationServiceImpl.log() org.jitsi.jigasi.xmpp.acc.VIDEO_CALLING_DISABLED=true
Jigasi 2021-06-22 09:21:38.274 INFO: [1] org.jitsi.impl.configuration.ConfigurationServiceImpl.log() net.java.sip.communicator.impl.protocol.jabber.acc1.RESOURCE_PRIORITY=30
Jigasi 2021-06-22 09:21:38.275 INFO: [1] org.jitsi.impl.configuration.ConfigurationServiceImpl.log() net.java.sip.communicator.impl.protocol.sip.acc1.JITSI_MEET_ROOM_HEADER_NAME=X-Room-Name
Jigasi 2021-06-22 09:21:38.275 INFO: [1] org.jitsi.impl.configuration.ConfigurationServiceImpl.log() net.java.sip.communicator.impl.protocol.jabber.acc1.IS_CARBON_DISABLED=true
Jigasi 2021-06-22 09:21:38.275 INFO: [1] org.jitsi.impl.configuration.ConfigurationServiceImpl.log() net.java.sip.communicator.impl.notifications.eventType1624353697815.actions.actionType1624353697815.enabled=true
Jigasi 2021-06-22 09:21:38.276 INFO: [1] org.jitsi.impl.configuration.ConfigurationServiceImpl.log() net.java.sip.communicator.impl.notifications.eventType1624353697816.actions.actionType1624353697816.default=true
Jigasi 2021-06-22 09:21:38.276 INFO: [1] org.jitsi.impl.configuration.ConfigurationServiceImpl.log() net.java.sip.communicator.impl.protocol.sip.acc1.DOMAIN_BASE=meet.jitsi
Jigasi 2021-06-22 09:21:38.276 INFO: [1] org.jitsi.impl.configuration.ConfigurationServiceImpl.log() net.java.sip.communicator.impl.protocol.jabber.acc1.VIDEO_CALLING_DISABLED=true
Jigasi 2021-06-22 09:21:38.277 INFO: [1] org.jitsi.impl.configuration.ConfigurationServiceImpl.log() net.java.sip.communicator.impl.protocol.sip.acc1.Encodings.speex/16000=0
Jigasi 2021-06-22 09:21:38.277 INFO: [1] org.jitsi.impl.configuration.ConfigurationServiceImpl.log() net.java.sip.communicator.impl.protocol.sip.acc1.VOICEMAIL_ENABLED=false
Jigasi 2021-06-22 09:21:38.282 INFO: [1] org.jitsi.impl.configuration.ConfigurationServiceImpl.log() net.java.sip.communicator.impl.notifications.eventType1624353697815.actions.actionType1624353697815=PopupMessageAction
Jigasi 2021-06-22 09:21:38.282 INFO: [1] org.jitsi.impl.configuration.ConfigurationServiceImpl.log() net.java.sip.communicator.impl.protocol.jabber.acc1.SERVER_ADDRESS=xmpp.meet.jitsi
Jigasi 2021-06-22 09:21:38.283 INFO: [1] org.jitsi.impl.configuration.ConfigurationServiceImpl.log() net.java.sip.communicator.impl.protocol.SingleCallInProgressPolicy.enabled=false
Jigasi 2021-06-22 09:21:38.284 INFO: [21] impl.protocol.sip.SipLogger.logInfo().196 Info from the JAIN-SIP stack: the sip stack timer gov.nist.javax.sip.stack.timers.DefaultSipTimer has been started
Jigasi 2021-06-22 09:21:38.284 INFO: [1] org.jitsi.impl.configuration.ConfigurationServiceImpl.log() net.java.sip.communicator.impl.protocol.sip.acc1.ACCOUNT_UID=SIP:jimlintw@sip2sip.info
Jigasi 2021-06-22 09:21:38.284 INFO: [1] org.jitsi.impl.configuration.ConfigurationServiceImpl.log() net.java.sip.communicator.impl.protocol.jabber.acc1.Encodings.H264/90000=0
Jigasi 2021-06-22 09:21:38.289 INFO: [1] org.jitsi.impl.configuration.ConfigurationServiceImpl.log() net.java.sip.communicator.impl.protocol.jabber.acc1.AUTO_GENERATE_RESOURCE=true
Jigasi 2021-06-22 09:21:38.289 INFO: [1] org.jitsi.impl.configuration.ConfigurationServiceImpl.log() net.java.sip.communicator.impl.neomedia.audioSystem.audiosilence.captureDevice_list=["AudioSilenceCaptureDevice", "AudioSilenceCaptureDevice:noTransferData"]
Jigasi 2021-06-22 09:21:38.290 INFO: [1] org.jitsi.impl.configuration.ConfigurationServiceImpl.log() net.java.sip.communicator.impl.protocol.sip.acc1.PREFERRED_TRANSPORT=UDP
Jigasi 2021-06-22 09:21:38.290 INFO: [1] org.jitsi.impl.configuration.ConfigurationServiceImpl.log() net.java.sip.communicator.impl.protocol.jabber.acc1.Encodings.GSM/8000=0
Jigasi 2021-06-22 09:21:38.291 INFO: [1] org.jitsi.impl.configuration.ConfigurationServiceImpl.log() net.java.sip.communicator.impl.protocol.jabber.acc1.Encodings.opus/48000=750
Jigasi 2021-06-22 09:21:38.291 INFO: [1] org.jitsi.impl.configuration.ConfigurationServiceImpl.log() net.java.sip.communicator.service.gui.ALWAYS_TRUST_MODE_ENABLED=true
Jigasi 2021-06-22 09:21:38.291 INFO: [1] org.jitsi.impl.configuration.ConfigurationServiceImpl.log() net.java.sip.communicator.impl.protocol.jabber.acc1.IS_USE_UPNP=false
Jigasi 2021-06-22 09:21:38.292 INFO: [1] org.jitsi.impl.configuration.ConfigurationServiceImpl.log() org.jitsi.jigasi.xmpp.acc.IM_DISABLED=true
Jigasi 2021-06-22 09:21:38.292 INFO: [1] org.jitsi.impl.configuration.ConfigurationServiceImpl.log() net.java.sip.communicator.impl.protocol.jabber.acc1.USE_DEFAULT_STUN_SERVER=true
Jigasi 2021-06-22 09:21:38.293 INFO: [1] org.jitsi.impl.configuration.ConfigurationServiceImpl.log() net.java.sip.communicator.impl.protocol.sip.acc1.Encodings.GSM/8000=0
Jigasi 2021-06-22 09:21:38.293 INFO: [1] org.jitsi.impl.configuration.ConfigurationServiceImpl.log() net.java.sip.communicator.impl.protocol.jabber.acc1.PROTOCOL=Jabber
Jigasi 2021-06-22 09:21:38.293 INFO: [1] org.jitsi.impl.configuration.ConfigurationServiceImpl.log() net.java.sip.communicator.impl.protocol.jabber.acc1.OVERRIDE_ENCODINGS=true
Jigasi 2021-06-22 09:21:38.294 INFO: [1] org.jitsi.impl.configuration.ConfigurationServiceImpl.log() net.java.sip.communicator.impl.protocol.jabber.acc1.IS_PREFERRED_PROTOCOL=false
Jigasi 2021-06-22 09:21:38.294 INFO: [1] org.jitsi.impl.configuration.ConfigurationServiceImpl.log() net.java.sip.communicator.impl.notifications.eventType1624353697816.actions.actionType1624353697816.timeout=-1
Jigasi 2021-06-22 09:21:38.294 INFO: [1] org.jitsi.impl.configuration.ConfigurationServiceImpl.log() net.java.sip.communicator.packetlogging.PACKET_LOGGING_ENABLED=false
Jigasi 2021-06-22 09:21:38.296 INFO: [1] org.jitsi.impl.configuration.ConfigurationServiceImpl.log() net.java.sip.communicator.impl.protocol.jabber.acc1.ENCRYPTION_PROTOCOL_STATUS.DTLS-SRTP=true
Jigasi 2021-06-22 09:21:38.296 INFO: [1] org.jitsi.impl.configuration.ConfigurationServiceImpl.log() net.java.sip.communicator.impl.protocol.jabber.acc1.Encodings.VP8/90000=0
Jigasi 2021-06-22 09:21:38.297 INFO: [1] org.jitsi.impl.configuration.ConfigurationServiceImpl.log() net.java.sip.communicator.impl.protocol.sip.acc1.Encodings.G722/8000=700
Jigasi 2021-06-22 09:21:38.297 INFO: [1] org.jitsi.impl.configuration.ConfigurationServiceImpl.log() net.java.sip.communicator.impl.protocol.jabber.acc1.Encodings.SILK/24000=0
Jigasi 2021-06-22 09:21:38.297 INFO: [1] org.jitsi.impl.configuration.ConfigurationServiceImpl.log() net.java.sip.communicator.impl.protocol.jabber.acc1.Encodings.G722/8000=705
Jigasi 2021-06-22 09:21:38.298 INFO: [1] org.jitsi.impl.configuration.ConfigurationServiceImpl.log() net.java.sip.communicator.impl.protocol.sip.acc1.KEEP_ALIVE_METHOD=OPTIONS
Jigasi 2021-06-22 09:21:38.298 INFO: [1] org.jitsi.impl.configuration.ConfigurationServiceImpl.log() net.java.sip.communicator.impl.protocol.sip.acc1.SERVER_ADDRESS=sip2sip.info
Jigasi 2021-06-22 09:21:38.299 INFO: [1] org.jitsi.impl.configuration.ConfigurationServiceImpl.log() net.java.sip.communicator.impl.protocol.sip.acc1.OVERRIDE_ENCODINGS=true
Jigasi 2021-06-22 09:21:38.299 INFO: [1] org.jitsi.impl.configuration.ConfigurationServiceImpl.log() net.java.sip.communicator.impl.neomedia.codec.audio.opus.encoder.COMPLEXITY=10
Jigasi 2021-06-22 09:21:38.299 INFO: [1] org.jitsi.impl.configuration.ConfigurationServiceImpl.log() org.jitsi.jigasi.xmpp.acc.SERVER_ADDRESS=xmpp.meet.jitsi
Jigasi 2021-06-22 09:21:38.299 INFO: [1] org.jitsi.impl.configuration.ConfigurationServiceImpl.log() net.java.sip.communicator.impl.protocol.jabber.acc1.DEFAULT_ENCRYPTION=true
Jigasi 2021-06-22 09:21:38.300 INFO: [1] org.jitsi.impl.configuration.ConfigurationServiceImpl.log() net.java.sip.communicator.impl.protocol.sip.acc1.Encodings.VP8/90000=0
Jigasi 2021-06-22 09:21:38.300 INFO: [1] org.jitsi.impl.configuration.ConfigurationServiceImpl.log() net.java.sip.communicator.impl.notifications.eventType1624353697815.actions.actionType1624353697815.default=true
Jigasi 2021-06-22 09:21:38.301 INFO: [1] org.jitsi.impl.configuration.ConfigurationServiceImpl.log() org.jitsi.jigasi.xmpp.acc.SERVER_STORED_INFO_DISABLED=true
Jigasi 2021-06-22 09:21:38.301 INFO: [1] org.jitsi.impl.configuration.ConfigurationServiceImpl.log() net.java.sip.communicator.impl.protocol.jabber.acc1.IS_ACCOUNT_DISABLED=false
Jigasi 2021-06-22 09:21:38.301 INFO: [1] org.jitsi.impl.configuration.ConfigurationServiceImpl.log() net.java.sip.communicator.impl.protocol.sip.acc1.PROTOCOL_NAME=SIP
Jigasi 2021-06-22 09:21:38.301 INFO: [1] org.jitsi.impl.configuration.ConfigurationServiceImpl.log() net.java.sip.communicator.impl.protocol.sip.acc1.Encodings.AMR-WB/16000=750
Jigasi 2021-06-22 09:21:38.302 INFO: [1] org.jitsi.impl.configuration.ConfigurationServiceImpl.log() net.java.sip.communicator.impl.protocol.sip.acc1.Encodings.red/90000=0
Jigasi 2021-06-22 09:21:38.302 INFO: [1] org.jitsi.impl.configuration.ConfigurationServiceImpl.log() net.java.sip.communicator.impl.protocol.jabber.acc1.IS_USE_ICE=true
Jigasi 2021-06-22 09:21:38.302 INFO: [1] org.jitsi.impl.configuration.ConfigurationServiceImpl.log() net.java.sip.communicator.impl.protocol.jabber.acc1.Encodings.H263-1998/90000=0
Jigasi 2021-06-22 09:21:38.303 INFO: [1] org.jitsi.impl.configuration.ConfigurationServiceImpl.log() net.java.sip.communicator.impl.protocol.jabber.acc1.BREWERY=jigasibrewery@internal-muc.meet.jitsi
Jigasi 2021-06-22 09:21:38.303 INFO: [1] org.jitsi.impl.configuration.ConfigurationServiceImpl.log() net.java.sip.communicator.impl.protocol.sip.acc1.USER_ID=jimlintw@sip2sip.info
Jigasi 2021-06-22 09:21:38.303 INFO: [1] org.jitsi.impl.configuration.ConfigurationServiceImpl.log() net.java.sip.communicator.impl.protocol.jabber.acc1.Encodings.SILK/12000=0
Jigasi 2021-06-22 09:21:38.304 INFO: [1] org.jitsi.impl.configuration.ConfigurationServiceImpl.log() net.java.sip.communicator.impl.protocol.sip.acc1.Encodings.H264/90000=0
Jigasi 2021-06-22 09:21:38.304 INFO: [1] org.jitsi.impl.configuration.ConfigurationServiceImpl.log() net.java.sip.communicator.impl.protocol.jabber.acc1.Encodings.telephone-event/8000=0
Jigasi 2021-06-22 09:21:38.304 INFO: [1] org.jitsi.impl.configuration.ConfigurationServiceImpl.log() net.java.sip.communicator.impl.protocol.jabber.acc1.Encodings.speex/16000=0
Jigasi 2021-06-22 09:21:38.305 INFO: [1] org.jitsi.impl.configuration.ConfigurationServiceImpl.log() net.java.sip.communicator.impl.protocol.sip.acc1.Encodings.opus/48000=1000
Jigasi 2021-06-22 09:21:38.305 INFO: [1] org.jitsi.impl.configuration.ConfigurationServiceImpl.log() net.java.sip.communicator.impl.protocol.sip.acc1=acc1
Jigasi 2021-06-22 09:21:38.305 INFO: [1] org.jitsi.impl.configuration.ConfigurationServiceImpl.log() net.java.sip.communicator.impl.protocol.jabber.acc1.ENCRYPTION_PROTOCOL.DTLS-SRTP=0
Jigasi 2021-06-22 09:21:38.306 INFO: [1] org.jitsi.impl.configuration.ConfigurationServiceImpl.log() net.java.sip.communicator.impl.protocol.jabber.acc1.ENCRYPTED_PASSWORD=**********
Jigasi 2021-06-22 09:21:38.306 INFO: [1] org.jitsi.impl.configuration.ConfigurationServiceImpl.log() net.java.sip.communicator.impl.protocol.sip.acc1.PROXY_PORT=5060
Jigasi 2021-06-22 09:21:38.306 INFO: [1] org.jitsi.impl.configuration.ConfigurationServiceImpl.log() net.java.sip.communicator.impl.notifications.eventType1624353697816=NewSelectedDevice
Jigasi 2021-06-22 09:21:38.306 INFO: [1] org.jitsi.impl.configuration.ConfigurationServiceImpl.log() net.java.sip.communicator.impl.notifications.eventType1624353697815=DeviceConfigurationChanged
Jigasi 2021-06-22 09:21:38.307 INFO: [1] org.jitsi.impl.configuration.ConfigurationServiceImpl.log() net.java.sip.communicator.impl.protocol.sip.acc1.Encodings.H263-1998/90000=0
Jigasi 2021-06-22 09:21:38.307 INFO: [1] org.jitsi.impl.configuration.ConfigurationServiceImpl.log() net.java.sip.communicator.impl.protocol.sip.acc1.PROXY_ADDRESS=sip2sip.info
Jigasi 2021-06-22 09:21:38.307 INFO: [1] org.jitsi.impl.configuration.ConfigurationServiceImpl.log() net.java.sip.communicator.impl.protocol.jabber.acc1.Encodings.SILK/16000=0
Jigasi 2021-06-22 09:21:38.307 INFO: [1] org.jitsi.impl.configuration.ConfigurationServiceImpl.log() net.java.sip.communicator.impl.protocol.jabber.acc1.Encodings.SILK/8000=0
Jigasi 2021-06-22 09:21:38.307 INFO: [1] org.jitsi.impl.configuration.ConfigurationServiceImpl.log() net.java.sip.communicator.impl.protocol.sip.acc1.Encodings.speex/32000=0
Jigasi 2021-06-22 09:21:38.308 INFO: [1] org.jitsi.impl.configuration.ConfigurationServiceImpl.log() net.java.sip.communicator.impl.protocol.jabber.acc1.Encodings.speex/8000=0
Jigasi 2021-06-22 09:21:38.308 INFO: [1] org.jitsi.impl.configuration.ConfigurationServiceImpl.log() net.java.sip.communicator.impl.protocol.jabber.acc1=acc1
Jigasi 2021-06-22 09:21:38.308 INFO: [1] org.jitsi.impl.configuration.ConfigurationServiceImpl.log() net.java.sip.communicator.impl.protocol.sip.acc1.Encodings.telephone-event/8000=1
Jigasi 2021-06-22 09:21:38.309 INFO: [1] org.jitsi.impl.configuration.ConfigurationServiceImpl.log() net.java.sip.communicator.impl.protocol.jabber.acc1.Encodings.PCMA/8000=0
Jigasi 2021-06-22 09:21:38.309 INFO: [1] org.jitsi.impl.configuration.ConfigurationServiceImpl.log() net.java.sip.communicator.impl.protocol.sip.acc1.ENCRYPTED_PASSWORD=**********
Jigasi 2021-06-22 09:21:38.310 INFO: [1] org.jitsi.impl.configuration.ConfigurationServiceImpl.log() org.jitsi.jigasi.HEALTH_CHECK_SIP_URI=
Jigasi 2021-06-22 09:21:38.310 INFO: [1] org.jitsi.impl.configuration.ConfigurationServiceImpl.log() net.java.sip.communicator.impl.notifications.eventType1624353697815.actions.actionType1624353697815.timeout=-1
Jigasi 2021-06-22 09:21:38.310 INFO: [1] org.jitsi.impl.configuration.ConfigurationServiceImpl.log() net.java.sip.communicator.impl.protocol.sip.acc1.Encodings.SILK/24000=0
Jigasi 2021-06-22 09:21:38.311 INFO: [1] org.jitsi.impl.configuration.ConfigurationServiceImpl.log() net.java.sip.communicator.impl.protocol.sip.acc1.Encodings.SILK/8000=0
Jigasi 2021-06-22 09:21:38.311 INFO: [1] org.jitsi.impl.configuration.ConfigurationServiceImpl.log() org.jitsi.jigasi.xmpp.acc.IS_SERVER_OVERRIDDEN=true
Jigasi 2021-06-22 09:21:38.311 INFO: [1] org.jitsi.impl.configuration.ConfigurationServiceImpl.log() org.jitsi.jigasi.BREWERY_ENABLED=true
Jigasi 2021-06-22 09:21:38.312 INFO: [1] org.jitsi.impl.configuration.ConfigurationServiceImpl.log() net.java.sip.communicator.impl.notifications.eventType1624353697816.actions.actionType1624353697816=PopupMessageAction
Jigasi 2021-06-22 09:21:38.312 INFO: [1] org.jitsi.impl.configuration.ConfigurationServiceImpl.log() net.java.sip.communicator.impl.notifications.eventType1624353697816.actions.actionType1624353697816.enabled=true
Jigasi 2021-06-22 09:21:38.313 INFO: [1] org.jitsi.impl.configuration.ConfigurationServiceImpl.log() net.java.sip.communicator.impl.protocol.sip.acc1.Encodings.ulpfec/90000=0
Jigasi 2021-06-22 09:21:38.313 INFO: [1] org.jitsi.impl.configuration.ConfigurationServiceImpl.log() net.java.sip.communicator.impl.protocol.sip.acc1.Encodings.PCMA/8000=600
Jigasi 2021-06-22 09:21:38.313 INFO: [1] org.jitsi.impl.configuration.ConfigurationServiceImpl.log() net.java.sip.communicator.impl.protocol.sip.acc1.Encodings.PCMU/8000=650
Jigasi 2021-06-22 09:21:38.314 INFO: [1] org.jitsi.impl.configuration.ConfigurationServiceImpl.log() net.java.sip.communicator.impl.protocol.jabber.acc1.ACCOUNT_UID=Jabber:jigasi@auth.meet.jitsi
Jigasi 2021-06-22 09:21:38.314 INFO: [1] org.jitsi.impl.configuration.ConfigurationServiceImpl.log() net.java.sip.communicator.impl.protocol.jabber.acc1.Encodings.PCMU/8000=0
Jigasi 2021-06-22 09:21:38.314 INFO: [1] org.jitsi.impl.configuration.ConfigurationServiceImpl.log() net.java.sip.communicator.impl.protocol.sip.acc1.KEEP_ALIVE_INTERVAL=25
Jigasi 2021-06-22 09:21:38.315 INFO: [1] org.jitsi.impl.configuration.ConfigurationServiceImpl.log() net.java.sip.communicator.impl.protocol.jabber.acc1.Encodings.iLBC/8000=0
Jigasi 2021-06-22 09:21:38.315 INFO: [1] org.jitsi.impl.configuration.ConfigurationServiceImpl.log() net.java.sip.communicator.impl.protocol.sip.acc1.Encodings.SILK/12000=0
Jigasi 2021-06-22 09:21:38.315 INFO: [1] org.jitsi.impl.configuration.ConfigurationServiceImpl.log() org.jitsi.jigasi.xmpp.acc.JINGLE_NODES_ENABLED=false
Jigasi 2021-06-22 09:21:38.315 INFO: [1] org.jitsi.impl.configuration.ConfigurationServiceImpl.log() net.java.sip.communicator.impl.protocol.jabber.acc1.DOMAIN_BASE=meet.jitsi
Jigasi 2021-06-22 09:21:38.316 INFO: [1] org.jitsi.impl.configuration.ConfigurationServiceImpl.log() net.java.sip.communicator.impl.protocol.jabber.acc1.USER_ID=jigasi@auth.meet.jitsi
Jigasi 2021-06-22 09:21:38.316 INFO: [1] org.jitsi.impl.configuration.ConfigurationServiceImpl.log() net.java.sip.communicator.impl.protocol.jabber.acc1.IS_SERVER_OVERRIDDEN=true
Jigasi 2021-06-22 09:21:38.316 INFO: [1] org.jitsi.impl.configuration.ConfigurationServiceImpl.log() org.jitsi.jigasi.xmpp.acc.IS_FILE_TRANSFER_DISABLED=true
Jigasi 2021-06-22 09:21:38.316 INFO: [1] org.jitsi.impl.configuration.ConfigurationServiceImpl.log() net.java.sip.communicator.impl.protocol.sip.acc1.JITSI_MEET_DOMAIN_BASE_HEADER_NAME=X-Domain-Base
Jigasi 2021-06-22 09:21:38.316 INFO: [1] org.jitsi.impl.configuration.ConfigurationServiceImpl.log() net.java.sip.communicator.impl.protocol.sip.acc1.Encodings.iLBC/8000=10
Jigasi 2021-06-22 09:21:38.317 INFO: [1] org.jitsi.impl.configuration.ConfigurationServiceImpl.log() net.java.sip.communicator.impl.protocol.sip.acc1.Encodings.SILK/16000=0
Jigasi 2021-06-22 09:21:38.317 INFO: [1] org.jitsi.impl.configuration.ConfigurationServiceImpl.log() net.java.sip.communicator.impl.protocol.sip.acc1.PROXY_AUTO_CONFIG=false
Jigasi 2021-06-22 09:21:38.317 INFO: [1] org.jitsi.impl.configuration.ConfigurationServiceImpl.log() org.jitsi.jigasi.HEALTH_CHECK_TIMEOUT=600000
Jigasi 2021-06-22 09:21:38.318 INFO: [1] org.jitsi.impl.configuration.ConfigurationServiceImpl.log() net.java.sip.communicator.impl.protocol.sip.acc1.Encodings.speex/8000=0
Jigasi 2021-06-22 09:21:38.318 INFO: [1] org.jitsi.impl.configuration.ConfigurationServiceImpl.log() org.jitsi.jigasi.xmpp.acc.AUTO_DISCOVER_STUN=false
Jigasi 2021-06-22 09:21:38.318 INFO: [1] org.jitsi.impl.configuration.ConfigurationServiceImpl.log() net.java.sip.communicator.impl.protocol.jabber.acc1.AUTO_DISCOVER_JINGLE_NODES=false
Jigasi 2021-06-22 09:21:38.318 INFO: [1] org.jitsi.impl.configuration.ConfigurationServiceImpl.log() org.jitsi.jigasi.MUC_SERVICE_ADDRESS=muc.meet.jitsi
Jigasi 2021-06-22 09:21:38.319 INFO: [1] org.jitsi.impl.configuration.ConfigurationServiceImpl.log() net.java.sip.communicator.impl.protocol.jabber.acc1.Encodings.speex/32000=0
Jigasi 2021-06-22 09:21:38.319 INFO: [1] org.jitsi.impl.configuration.ConfigurationServiceImpl.log() org.jitsi.jigasi.HEALTH_CHECK_INTERVAL=300000
Jigasi 2021-06-22 09:21:39.120 INFO: [43] impl.protocol.jabber.OperationSetBasicTelephonyJabberImpl.registrationStateChanged().127 Jingle : ON 
Jigasi 2021-06-22 09:21:39.140 INFO: [36] org.jitsi.jigasi.SipGateway.registrationStateChanged().120 REG STATE CHANGE ProtocolProviderServiceSipImpl(SIP:jimlintw@sip2sip.info) -> RegistrationStateChangeEvent[ oldState=Unregistered; newState=RegistrationState=Registering; userRequest=false; reasonCode=-1; reason=null]
Jigasi 2021-06-22 09:21:39.211 INFO: [43] impl.protocol.jabber.ProtocolProviderServiceJabberImpl.authenticated().2423 Authenticated: false
Jigasi 2021-06-22 09:21:39.230 INFO: [43] impl.protocol.jabber.OperationSetPersistentPresenceJabberImpl.createAccountPhotoPresenceInterceptor().1987 Can not retrieve account avatar for jigasi@auth.meet.jitsi/jitsi-1hlbkap: XMPPError: item-not-found - cancel
Jigasi 2021-06-22 09:21:39.239 INFO: [56] impl.protocol.jabber.JingleNodesServiceDiscovery.run().111 Start Jingle Nodes discovery!
Jigasi 2021-06-22 09:21:39.240 INFO: [56] impl.protocol.jabber.JingleNodesServiceDiscovery.run().151 Jingle Nodes discovery terminated! 
Jigasi 2021-06-22 09:21:39.241 INFO: [56] impl.protocol.jabber.JingleNodesServiceDiscovery.run().152 Found 0 Jingle Nodes relay for account: jigasi@auth.meet.jitsi in 2 ms.
Jigasi 2021-06-22 09:21:39.248 INFO: [43] org.jitsi.jigasi.xmpp.CallControlMucActivator.joinCommonRoom().291 Joining call control room: jigasibrewery@internal-muc.meet.jitsi pps:ProtocolProviderServiceJabberImpl(Jabber:jigasi@auth.meet.jitsi)
Jigasi 2021-06-22 09:21:39.306 INFO: [51] impl.protocol.jabber.ChatRoomJabberImpl.joined().1361 jigasibrewery@internal-muc.meet.jitsi/focus has joined the jigasibrewery@internal-muc.meet.jitsi chat room.
Jigasi 2021-06-22 09:22:43.370 INFO: [33] org.jitsi.jigasi.SipGateway.registrationStateChanged().120 REG STATE CHANGE ProtocolProviderServiceSipImpl(SIP:jimlintw@sip2sip.info) -> RegistrationStateChangeEvent[ oldState=Registering; newState=RegistrationState=Connection Failed; userRequest=false; reasonCode=-1; reason=A timeout occurred while trying to connect to the server.]
Jigasi 2021-06-22 09:22:43.371 INFO: [33] impl.protocol.sip.SipLogger.logInfo().196 Info from the JAIN-SIP stack: the sip stack timer gov.nist.javax.sip.stack.timers.DefaultSipTimer has been stopped
Jigasi 2021-06-22 09:22:44.372 INFO: [33] impl.protocol.sip.SipLogger.logInfo().196 Info from the JAIN-SIP stack: the sip stack timer gov.nist.javax.sip.stack.timers.DefaultSipTimer has been stopped
```

**Comment by cclin81922** [comment]
Here is the tcpdump result

```
22:10:41.393176 IP 192.168.112.116.57059 > ns2.dns-hosting.info.sip: SIP: REGISTER sip:sip2sip.info SIP/2.0
22:10:41.899820 IP 192.168.112.116.57059 > ns2.dns-hosting.info.sip: SIP: REGISTER sip:sip2sip.info SIP/2.0
22:10:41.919514 IP ns2.dns-hosting.info > 192.168.112.116: ICMP ns2.dns-hosting.info udp port sip unreachable, length 533
22:10:42.267363 IP ns2.dns-hosting.info > 192.168.112.116: ICMP ns2.dns-hosting.info udp port sip unreachable, length 533
22:10:42.902430 IP 192.168.112.116.57059 > ns2.dns-hosting.info.sip: SIP: REGISTER sip:sip2sip.info SIP/2.0
22:10:43.305236 IP ns2.dns-hosting.info > 192.168.112.116: ICMP ns2.dns-hosting.info udp port sip unreachable, length 533
22:10:44.903583 IP 192.168.112.116.57059 > ns2.dns-hosting.info.sip: SIP: REGISTER sip:sip2sip.info SIP/2.0
22:10:45.344170 IP ns2.dns-hosting.info > 192.168.112.116: ICMP ns2.dns-hosting.info udp port sip unreachable, length 533
22:10:48.900115 IP 192.168.112.116.57059 > ns2.dns-hosting.info.sip: SIP: REGISTER sip:sip2sip.info SIP/2.0
22:10:49.213510 IP ns2.dns-hosting.info > 192.168.112.116: ICMP ns2.dns-hosting.info udp port sip unreachable, length 533
22:10:52.934710 IP 192.168.112.116.57059 > ns2.dns-hosting.info.sip: SIP: REGISTER sip:sip2sip.info SIP/2.0
22:10:53.228141 IP ns2.dns-hosting.info > 192.168.112.116: ICMP ns2.dns-hosting.info udp port sip unreachable, length 533
22:10:56.932733 IP 192.168.112.116.57059 > ns2.dns-hosting.info.sip: SIP: REGISTER sip:sip2sip.info SIP/2.0
22:10:57.425804 IP ns2.dns-hosting.info > 192.168.112.116: ICMP ns2.dns-hosting.info udp port sip unreachable, length 533
22:11:00.935116 IP 192.168.112.116.57059 > ns2.dns-hosting.info.sip: SIP: REGISTER sip:sip2sip.info SIP/2.0
22:11:01.413703 IP ns2.dns-hosting.info > 192.168.112.116: ICMP ns2.dns-hosting.info udp port sip unreachable, length 533
22:11:04.938001 IP 192.168.112.116.57059 > ns2.dns-hosting.info.sip: SIP: REGISTER sip:sip2sip.info SIP/2.0
22:11:05.250570 IP ns2.dns-hosting.info > 192.168.112.116: ICMP ns2.dns-hosting.info udp port sip unreachable, length 533
22:11:08.939061 IP 192.168.112.116.57059 > ns2.dns-hosting.info.sip: SIP: REGISTER sip:sip2sip.info SIP/2.0
22:11:09.244928 IP ns2.dns-hosting.info > 192.168.112.116: ICMP ns2.dns-hosting.info udp port sip unreachable, length 533
22:11:12.940799 IP 192.168.112.116.57059 > ns2.dns-hosting.info.sip: SIP: REGISTER sip:sip2sip.info SIP/2.0
22:11:13.421180 IP ns2.dns-hosting.info > 192.168.112.116: ICMP ns2.dns-hosting.info udp port sip unreachable, length 533
22:11:13.447981 IP 192.168.112.116.57059 > 81.23.228.137.sip: SIP: REGISTER sip:sip2sip.info SIP/2.0
22:11:13.808175 IP 81.23.228.137 > 192.168.112.116: ICMP 81.23.228.137 udp port sip unreachable, length 533
22:11:13.948426 IP 192.168.112.116.57059 > 81.23.228.137.sip: SIP: REGISTER sip:sip2sip.info SIP/2.0
22:11:14.421906 IP 81.23.228.137 > 192.168.112.116: ICMP 81.23.228.137 udp port sip unreachable, length 533
22:11:14.952333 IP 192.168.112.116.57059 > 81.23.228.137.sip: SIP: REGISTER sip:sip2sip.info SIP/2.0
22:11:15.415456 IP 81.23.228.137 > 192.168.112.116: ICMP 81.23.228.137 udp port sip unreachable, length 533
22:11:16.952676 IP 192.168.112.116.57059 > 81.23.228.137.sip: SIP: REGISTER sip:sip2sip.info SIP/2.0
22:11:17.291586 IP 81.23.228.137 > 192.168.112.116: ICMP 81.23.228.137 udp port sip unreachable, length 533
22:11:20.953773 IP 192.168.112.116.57059 > 81.23.228.137.sip: SIP: REGISTER sip:sip2sip.info SIP/2.0
22:11:21.281974 IP 81.23.228.137 > 192.168.112.116: ICMP 81.23.228.137 udp port sip unreachable, length 533
22:11:24.989065 IP 192.168.112.116.57059 > 81.23.228.137.sip: SIP: REGISTER sip:sip2sip.info SIP/2.0
22:11:25.484842 IP 81.23.228.137 > 192.168.112.116: ICMP 81.23.228.137 udp port sip unreachable, length 533
22:11:28.987705 IP 192.168.112.116.57059 > 81.23.228.137.sip: SIP: REGISTER sip:sip2sip.info SIP/2.0
22:11:29.378264 IP 81.23.228.137 > 192.168.112.116: ICMP 81.23.228.137 udp port sip unreachable, length 533
22:11:32.987005 IP 192.168.112.116.57059 > 81.23.228.137.sip: SIP: REGISTER sip:sip2sip.info SIP/2.0
22:11:33.472358 IP 81.23.228.137 > 192.168.112.116: ICMP 81.23.228.137 udp port sip unreachable, length 533
22:11:36.988468 IP 192.168.112.116.57059 > 81.23.228.137.sip: SIP: REGISTER sip:sip2sip.info SIP/2.0
22:11:37.359640 IP 81.23.228.137 > 192.168.112.116: ICMP 81.23.228.137 udp port sip unreachable, length 533
22:11:40.991877 IP 192.168.112.116.57059 > 81.23.228.137.sip: SIP: REGISTER sip:sip2sip.info SIP/2.0
22:11:41.486067 IP 81.23.228.137 > 192.168.112.116: ICMP 81.23.228.137 udp port sip unreachable, length 533
22:11:44.994504 IP 192.168.112.116.57059 > 81.23.228.137.sip: SIP: REGISTER sip:sip2sip.info SIP/2.0
22:11:45.351452 IP 81.23.228.137 > 192.168.112.116: ICMP 81.23.228.137 udp port sip unreachable, length 533
```

**Comment by cclin81922** [comment]
Fixed this problem by correcting the sip protocol.

**Comment by tomrebibo** [comment]
how did you correct your sip protocol?

**Comment by basco** [comment]
> 

Please explain how you corrected the sip protocol. Thanks!

**Comment by basco** [comment]
> Fixed this problem by correcting the sip protocol.
Please explain how you corrected the sip protocol. Thanks!

**Comment by basco** [comment]
> Please explain how you corrected the sip protocol. Thanks!

Please explain how exactly you solved this. thanks!

**Comment by basco** [comment]
> Fixed this problem by correcting the sip protocol.

Please explain how you solved this. thanks!

**Comment by humble92** [comment]
Could you share how to resolve this issue?

**Comment by Vishaltalsaniya-7** [comment]
> Could you share how to resolve this issue?

.env in 
# SIP server transport
#JIGASI_SIP_TRANSPORT=UDP to   Change   TCP
then  working  Registrations
